{
  "schema_version": "1.0",
  "document_type": "perceptshift.forge_config",
  "project": {
    "name": "demo",
    "output_root": "/tmp/out",
    "random_seed": 1
  },
  "model": {
    "baseline_path": "/tmp/model.onnx",
    "adapter": "image_classification",
    "adapter_config": {},
    "expected_input": {},
    "allowed_model_roots": []
  },
  "datasets": {
    "calibration_manifest": "/tmp/cal.json",
    "evaluation_manifest": "/tmp/eval.json",
    "prohibit_cross_split_duplicates": true
  },
  "quantization": {
    "enabled": false,
    "methods": [
      "minmax"
    ],
    "format": "qdq",
    "activation_type": "qint8",
    "weight_type": "qint8",
    "per_channel_options": [
      false
    ],
    "nodes_to_exclude": [],
    "calibration_sample_limit": null
  },
  "candidates": {
    "include_baseline": true,
    "user_model_variants": [],
    "execution_providers": [
      {
        "name": "cpu",
        "provider_order": [
          "CPUExecutionProvider"
        ]
      }
    ],
    "xnnpack_thread_counts": [
      1
    ],
    "ort_intra_op_thread_counts": [
      1
    ],
    "ort_inter_op_thread_counts": [
      1
    ],
    "allow_intra_op_spinning": [
      false
    ],
    "graph_optimization_levels": [
      "all"
    ],
    "preprocess_backends": [
      "scalar"
    ],
    "input_variants": []
  },
  "benchmark": {
    "warmup_iterations": 1,
    "measured_iterations": 1,
    "independent_trials": 1,
    "randomize_candidate_order": true,
    "cold_start_trials": 0,
    "per_candidate_timeout_seconds": 60,
    "maximum_worker_rss_mb": 1024,
    "minimum_stabilization_seconds": 0,
    "maximum_start_temperature_c": 90.0,
    "maximum_temperature_drift_c": 50.0,
    "require_no_throttling": false,
    "collect_perf": false,
    "collect_ros_trace": false,
    "bootstrap_resamples": 100
  },
  "quality": {
    "metric_name": "top1_accuracy",
    "direction": "higher_is_better",
    "minimum_absolute_value": 0.0,
    "maximum_degradation_from_baseline": 1.0,
    "confidence_level": 0.95
  },
  "certification": {
    "deadline_ms": 100.0,
    "maximum_peak_rss_mb": 2048,
    "maximum_model_size_mb": 1024,
    "require_xnnpack_assignment": false,
    "maximum_cpu_fallback_fraction": null,
    "require_valid_environment": false,
    "require_output_equivalence": false,
    "sign_bundle": false,
    "signing_key_path": null
  },
  "report": {
    "formats": [
      "json"
    ],
    "include_raw_sample_links": false,
    "include_environment": true
  }
}
